"doc_id","text","album","year","songwriters","vocals","songwriter_Harrison","songwriter_Lennon","songwriter_McCartney","songwriter_Starr","vocals_Harrison","vocals_Lennon","vocals_McCartney","vocals_Starr","negative","positive","<NA>","sentiment"
"Only a Northern Song","If you're listening to this song, You may think the cords are going wrong. But they're not We just wrote it like that  When you're listening late at night, You may think the bands are not quite right, But they are, They just play it like that  It doesn't really matter what chords I play, What words I say, Or time of day it is As it's only a northern song  *music*  It doesn't really matter what clothes I wear, Or how I pur Or if my hair is brown When it's only a northern song  If you think the harmony Is a little dark and out of key, You're correct, There's nobody there  And it told you there's no one there  *music*  Adicionar  playlist","Yellow Submarine","1967","Harrison","Harrison",1,0,0,0,1,0,0,0,2,5,46,3
"P.S. I Love You","As I write this letter Send my love to you Remember that I'll always Be in love with you  Treasure these few words till we're together Keep all my love forever P.S. I love you You, you, you  I'll be coming home again to you, love And till the day I do, love P.S. I love you You, you, you  As I write this letter Send my love to you Remember that I'll always Be in love with you  Treasure these few words till we're together Keep all my love forever P.S. I love you You, you, you  As I write this letter (Oh) Send my love to you (You know I want you to) Remember that I'll always (Yeah) Be in love with you  I'll be coming home again to you, love And till the day I do, love P.S. I love you You, you, you You, you, you I love you","Please Please Me","1962","Lennon/McCartney","McCartney",0,1,1,0,0,0,1,0,0,19,36,19
"Paperback Writer","Paperback writer Writer, writer Dear, sir or madam, will you read my book? It took me years to write, will you take a look? It's based on a novel by a man named Lear And I need a job, so I want to be a paperback writer  Paperback writer!  It's a dirty story of a dirty man And his clinging wife doesn't understand His son is working for the Daily Mail It's a steady job, but he wants to be a paperback writer  Paperback writer!  Paperback writer Writer, writer  It's a thousand pages, give or take a few I'll be writing more in a week or two I can make it longer if you like the style I can change it 'round, but I want to be a paperback writer  Paperback writer!  If you really like it, you can have the right You can make a million for you overnight If you must return it, you can send here But I need a break, and I want to be a paperback writer  Paperback writer!  Paperback writer Writer, writer  Paperback writer Paperback writer Paperback writer Paperback writer  Adicionar  playlist",NA,"1966","McCartney","McCartney",0,0,1,0,0,0,1,0,3,4,96,1
"Penny Lane","Penny lane there is a barber showing photographs Of every head hes had the pleasure to have known And all the people that come and go Stop and say hello  On the corner is a banker with a motor car The little children laugh at him behind his back And the banker never wears a mac In the pouring rain Very strange  Penny lane is in my ears and in my eyes There beneath the blue suburban skies I sit and meanwhile back  In penny lane there is a fireman with an hourglass And in his pocket is a portrait of the queen He likes to keep his fire engine clean Its a clean machine  Penny lane is in my ears and in my eyes A four of fish and finger pies In summer, meanwhile back  Behind the shelter in the middle of the roundabout The pretty nurse is selling poppies from a tray And though she feels as if shes in a play She is anyway  Penny lane the barber shaves another customer We see the banker sitting waiting for a trim And then the fireman rushes in From the pouring rain Very strange  Penny lane is in my ears and in my eyes There beneath the blue suburban skies Penny lane is in my ears and in my eyes There beneath the blue suburban skies Penny lane","Magical Mystery Tour","1966","McCartney","McCartney",0,0,1,0,0,0,1,0,2,5,106,3
"Piggies","Have you seen the little piggies Crawling in the dirt? And for all the little piggies, Life is getting worse; Always having dirt to Play around in.  Have you seen the bigger piggies In their starched white shirts? You will find the bigger piggies Stirring up the dirt Always have clean shirts to Play around in.  In their styes with all their backing, They don't care What goes on around. In their eyes there's something lacking. What they need's a damn good whacking.  Everywhere there's lots of piggies Living piggy lives. You can see them out for dinner With their piggy wives. Clutching forks and knives to Eat their bacon.","The Beatles","1968","Harrison","Harrison",1,0,0,0,1,0,0,0,6,2,51,-4
"Please Please Me","Last night I said these words to my girl I know you never even try, girl C\'mon (C\'mon), c\'mon (C\'mon), c\'mon (C\'mon), c\'mon (C\'mon) Please please me, whoa yeah, like I please you  You don\'t need me to show the way, love Why do I always have to say ""love"" C\'mon (C\'mon), c\'mon (C\'mon), c\'mon (C\'mon), c\'mon (C\'mon) Please please me, whoa yeah, like I please you  I don\'t wanna sound complaining But you know there\'s always rain in my heart (In my heart) I do all the pleasing with you, it\'s so hard to reason With you, whoah yeah, why do you make me blue  Last night I said these words to my girl I know you never even try, girl C\'mon (C\'mon), c\'mon (C\'mon), c\'mon (C\'mon), c\'mon (C\'mon) Please please me, whoa yeah, like I please you (Me) Whoa yeah, like I please you (Me) Whoa yeah, like I please you","Please Please Me","1962","Lennon","Lennon/McCartney",0,1,0,0,0,1,1,0,2,13,79,11
"Polythene Pam","Well you should see Polythene Pam She\'s so good-looking but she looks like a man Well you should see her in drag dressed in her polythene bag Yes you should see Polythene Pam Yeah yeah yeah  Get a dose of her in jackboots and kilt She\'s killer-diller when she\'s dressed to the hilt She\'s the kind of a girl that makes the ""News of the World"" Yes you could say she was attractively built Yeah yeah yeah","Abbey Road","1969","Lennon","Lennon",0,1,0,0,0,1,0,0,1,4,35,3
"Revolution","You say you want a revolution Well, you know We all want to change the world You tell me that it's evolution Well, you know We all want to change the world  But when you talk about destruction Don't you know that you can count me out  Don't you know it's gonna be alright Alright, alright  You say you got a real solution Well, you know We'd all love to see the plan You ask me for a contribution Well, you know We're all doing what we can  But if you want money for people with minds that hate All I can tell you is brother you have to wait  Don't you know it's gonna be alright Alright, alright, al...  You say you'll change the constitution Well, you know We all want to change your head You tell me it's the institution Well, you know You'd better free your mind instead  But if you go carrying pictures of Chairman Mao You ain't going to make it with anyone anyhow  Don't you know know it's gonna be alright Alright, alright  Alright, alright Alright, alright Alright, alright Alright, alright",NA,"1968","Lennon","Lennon",0,1,0,0,0,1,0,0,2,10,80,8
"Revolution 1","Ah, take 2 OK!  You say you want a revolution Well you know We all want to change the world You tell me that it's evolution Well you know We all want to change the world But when you talk about destruction Don't you know you can count me out in Don't you know it's gonna be alright Don't you know it's gonna be alright Don't you know it's gonna be alright  You say you got a real solution Well you know We'd all love to see the plan You ask me for a contribution Well you know We're doing what we can But if you want money for people with minds that hate All I can tell you is brother you have to wait Don't you know it's gonna be alright Don't you know it's gonna be alright Don't you know it's gonna be alright  You say you'll change the constitution Well you know We'd all love to change your head You tell me it's the institution Well you know You better free your mind instead But if you go carrying pictures of Chairman Mao You ain't going to make it with anyone anyhow Don't you know it's gonna be alright Don't you know it's gonna be alright Don't you know it's gonna be alright  Oh, oh, oh, oh, oh, oh, oh, oh, oh, oh Alright, alright, alright, alright, alright Alright, alright, alright, alright, alright Oh, oh, oh, oh, oh, oh Alright, alright, alright Alright Alright","The Beatles","1968","Lennon","Lennon",0,1,0,0,0,1,0,0,2,11,98,9
"Rocky Raccoon","Now somewhere in the black mountain hills of Dakota There lived a young boy named Rocky Raccoon And one day his woman ran off with another guy Hit young Rocky in the eye Rocky didn't like that He said I'm gonna get that boy So one day he walked into town Booked himself a room in the local saloon  Rocky Raccoon checked into his room Only to find Gideon's bible Rocky had come equipped with a gun To shoot off the legs of his rival His rival it seems had broken his dreams By stealing the girl of his fancy Her name was Magil and she called herself Lil But everyone knew her as Nancy Now she and her man who called himself Dan Were in the next room at the hoe down Rocky burst in and grinning a grin He said Danny boy this is a showdown But Daniel was hot, he drew first and shot And Rocky collapsed in the corner, ah  D'da d'da d'da da da da D'da d'da d'da da da da D'da d'da d'da da d'da d'da d'da d'da Do do do do do do  D'do d'do d'do do do do D'do d'do d'do do do do D'do d'do d'do do do d'do d'do d'do d'do Do do do do do do  Now the doctor came in stinking of gin And proceeded to lie on the table He said Rocky you met your match And Rocky said, doc it's only a scratch And I'll be better I'll be better doc as soon as I am able  And now Rocky Raccoon he fell back in his room Only to find Gideon's bible Gideon checked out and he left it no doubt To help with good Rocky's revival, ah Oh yeah, yeah  D'do d'do d'do do do do D'do d'do d'do do do do D'do d'do d'do do do d'do d'do d'do d'do Do do do do do do  D'do d'do d'do do do do, come on, Rocky boy D'do d'do d'do do do do, come on, Rocky boy D'do d'do d'do do do d'do d'do d'do d'do The story of Rocky there","The Beatles","1968","Lennon/McCartney","McCartney",0,1,1,0,0,0,1,0,22,8,118,-14
"Run for Your Life","Well I'd rather see you dead, little girl Than to be with another man You better keep your head, little girl Or I won't know where I am  You better run for your life if you can, little girl Hide your head in the sand little girl Catch you with another man That's the end ah little girl  Well I know that I'm a wicked guy And I was born with a jealous mind And I can't spend my whole life Trying just to make you toe the line  You better run for your life if you can, little girl Hide your head in the sand little girl Catch you with another man That's the end ah little girl  Let this be a sermon I mean everything I've said Baby, I'm determined And I'd rather see you dead  You better run for your life if you can, little girl Hide your head in the sand little girl Catch you with another man That's the end ah little girl  I'd rather see you dead, little girl Than to be with another man You better keep your head, little girl Or you won't know where I am  You better run for your life if you can, little girl Hide your head in the sand little girl Catch you with another man That's the end ah little girl Nah nah nah Nah nah nah Nah nah nah Nah nah nah (fade out)","Rubber Soul","1965","Lennon/McCartney","Lennon",0,1,1,0,0,1,0,0,5,8,120,3
"Savoy Truffle","Creme tangerine and montelimar A ginger sling with a pineapple heart A coffee dessert, yes, you know it's good news But you'll have to have them all pulled out After the Savoy truffle  Cool cherry cream, nice apple tart I feel your taste all the time we're apart Coconut fudge really blows down those blues But you'll have to have them all pulled out After the Savoy truffle  You might not feel it now But when the pain cuts through You're going to know and how The sweat is going to fill your head When it becomes too much You'll shout aloud  [Instrumental/Solo]  But you'll have to have them all pulled out After the Savoy truffle  You know that what you eat you are But what is sweet now turns so sour We all know obla-dibla-da But can you show me where you are?  Creme tangerine and montelimar A ginger sling with a pineapple heart A coffee dessert, yes, you know it's good news But you'll have to have them all pulled out After the Savoy truffle  Yes you'll have to have them all pulled out After the Savoy truffle","The Beatles","1968","Harrison","Harrison",1,0,0,0,1,0,0,0,3,5,75,2
"Sexy Sadie","Sexy Sadie what have you done You made a fool of everyone You made a fool of everyone Sexy Sadie ooh what have you done  Sexy Sadie you broke the rules You layed it down for all to see You layed it down for all to see Sexy Sadie oooh you broke the rules  One sunny day the world was waiting for a lover She came along to turn on everyone Sexy Sadie the greatest of them all  Sexy Sadie how did you know The world was waiting just for you The world was waiting just for you Sexy Sadie oooh how did you know  Sexy Sadie you'll get yours yet However big you think you are However big you think you are Sexy Sadie oooh you'll get yours yet  We gave her everything we owned just to sit at her table Just a smile would lighten everything Sexy Sadie she's the latest and the greatest of them all  She made a fool of everyone Sexy Sadie  However big you think you are Sexy Sadie","The Beatles","1968","Lennon","Lennon",0,1,0,0,0,1,0,0,5,16,70,11
"Sgt. Pepper's Lonely Hearts Club Band","It was twenty years ago today Sgt. Pepper taught the band to play They've been going in and out of style But they're guaranteed to raise a smile So may I introduce to you The act you've known for all these years Sgt. Pepper's Lonely Hearts Club Band  We're Sgt. Pepper's Lonely Hearts Club Band We hope you will enjoy the show We're Sgt. Pepper's Lonely Hearts Club Band Sit back and let the evening go Sgt. Pepper's lonely, Sgt. Pepper's lonely Sgt. Pepper's Lonely Hearts Club Band It's wonderful to be here It's certainly a thrill You're such a lovely audience We'd like to take you home with us We'd love to take you home  I don't really want to stop the show But I thought that you might like to know That the singer's going to sing a song And he wants you all to sing along So let me introduce to you The one and only Billy Shears And Sgt. Pepper's Lonely Hearts Club Band","Sgt. Pepper's Lonely Hearts Club Band","1967","McCartney","Lennon/McCartney/Harrison/Starr",0,0,1,0,1,1,1,1,7,8,79,1
"Sgt. Pepper's Lonely Hearts Club Band (Reprise)","(1,2,3,4  Bye!)  We're Sgt. Pepper's Lonely Hearts Club Band We hope you have enjoyed the show Sgt. Pepper's Lonely Hearts Club Band We're sorry but it's time to go Sgt. Pepper's lonely, Sgt. Pepper's lonely Sgt. Pepper's lonely, Sgt. Pepper's lonely Sgt. Pepper's Lonely Hearts Club Band We'd like to thank you once again Sgt. Pepper's one and only Lonely Hearts Club Band It's getting very near the end Sgt. Pepper's lonely, Sgt. Pepper's lonely Sgt. Pepper's Lonely Hearts Club Band","Sgt. Pepper's Lonely Hearts Club Band","1967","McCartney","Lennon/McCartney/Harrison/Starr",0,0,1,0,1,1,1,1,12,3,46,-9
"She Came in Through the Bathroom Window","(Gonna come out now, ha ha ha, wow look out.)  She came in through the bathroom window Protected by a silver spoon But now she sucks her thumb and wanders By the banks of her own lagoon  Didn't anybody tell her? Didn't anybody see? Sunday's on the phone to Monday Tuesday's on the phone to me  She said she'd always been a dancer She worked at 15 clubs a day And though she thought I knew the answer Well I knew what I could not say  And so I quit the police department And got myself a steady job And though she tried her best to help me She could steal but she could not rob  Didn't anybody tell her? Didn't anybody see? Sunday's on the phone to Monday Tuesday's on the phone to me Oh yeah","Abbey Road","1969","McCartney","McCartney",0,0,1,0,0,0,1,0,2,5,54,3
"She Loves You","She loves you, yeah, yeah, yeah She loves you, yeah, yeah, yeah She loves you, yeah, yeah, yeah, yeah  You think you lost your love Well, I saw her yesterday It's you she's thinking of And she told me what to say  She says she loves you And you know that can't be bad Yes, she loves you And you know you should be glad  She said you hurt her so She almost lost her mind But now she says she knows You're not the hurting kind  She says she loves you And you know that can't be bad Yes, she loves you And you know you should be glad, ooh  She loves you, yeah, yeah, yeah She loves you, yeah, yeah, yeah And with a love like that You know you should be glad  You know it's up to you I think it's only fair Pride can hurt you too Apologize to her  Because she loves you And you know that can't be bad Yes, she loves you And you know you should be glad, ooh  She loves you, yeah, yeah, yeah She loves you, yeah, yeah, yeah With a love like that You know you should be glad With a love like that You know you should be glad With a love like that You know you should be glad Yeah, yeah, yeah Yeah, yeah, yeah, yeah",NA,"1963","Lennon/McCartney","Lennon/McCartney",0,1,1,0,0,1,1,0,8,32,63,24
"She Said She Said","She said, ""I know what it\'s like to be dead. I know what it is to be sad."" And she\'s making me feel like I\'ve never been born  I said, ""Who put all those things in your head? Things that make me feel that I\'m mad. And you\'re making me feel like I\'ve never been born.""  She said, ""You don\'t understand what I said."" I said, ""No, no, no, you\'re wrong. When I was a boy everything was right, Everything was right.""  I said, ""Even though you know what you know, I know that I\'m ready to leave \'Cause you\'re making me feel like I\'ve never been born.""  She said, ""You don\'t understand what I said."" I said, ""No, no, no, you\'re wrong. When I was a boy everything was right, Everything was right.""  I said, ""Even though you know what you know, I know that I\'m ready to leave \'Cause you\'re making me feel like I\'ve never been born.""  She said, ""I know what it\'s like to be dead. I know what it is to be sad. I know what it\'s like to be dead...","Revolver","1966","Lennon","Lennon",0,1,0,0,0,1,0,0,8,13,62,5
"She's Leaving Home","Wednesday morning at five o'clock as the day begins Silently closing her bedroom door Leaving the note that she hoped would say more She goes downstairs to the kitchen clutching her handkerchief Quietly turning the backdoor key Stepping outside she is free  She (We gave her most of our lives) Is leaving (Sacrificed most of our lives) Home (We gave her everything money could buy) She's leaving home after living alone For so many years (Bye bye)  Father snores as his wife gets into her dressing gown Picks up the letter that's lying there Standing alone at the top of the stairs She breaks down and cries to her husband ""Daddy our baby's gone Why would she treat us so thoughtlessly? How could she do this to me?""  She (We never thought of ourselves) Is leaving (Never a thought for ourselves) Home (We struggled hard all our lives to get by) She's leaving home after living alone For so many years (Bye bye)  Friday morning at nine o'clock she is far away Waiting to keep the appointment she made Meeting a man from the motor trade  She (What did we do that was wrong) Is having (We didn't know it was wrong) Fun (Fun is the one thing that money can't buy) Something inside that was always denied For so many years (Bye bye)  She's leaving home Bye bye","Sgt. Pepper's Lonely Hearts Club Band","1967","Lennon/McCartney","Lennon/McCartney",0,1,1,0,0,1,1,0,9,4,105,-5
"Something","Something in the way she moves Attracts me like no other lover Something in the way she woos me  I don't want to leave her now You know I believe and how  Somewhere in her smile she knows That I don't need no other lover Something in her style that shows me  Don't want to leave her now You know I believe and how  You're asking me will my love grow I don't know, I don't know You stick around, now it may show I don't know, I don't know  Something in the way she knows And all I have to do is think of her Something in the things she shows me  I don't want to leave her now You know I believe and how","Abbey Road","1969","Harrison","Harrison",1,0,0,0,1,0,0,0,0,5,47,5
"Strawberry Fields Forever","Let me take you down, 'cause I'm going to Strawberry Fields Nothing is real and nothing to get hung about Strawberry Fields forever  Living is easy with eyes closed Misunderstanding all you see It's getting hard to be someone but it all works out It doesn't matter much to me Let me take you down, cause I'm going to Strawberry Fields Nothing is real and nothing to get hung about Strawberry Fields forever  No one I think is in my tree I mean it must be high or low That is you can't you know tune in but it's all right That is I think it's not too bad Let me take you down, cause I'm going to Strawberry Fields Nothing is real and nothing to get hung about Strawberry Fields forever  Always, no sometimes, think it's me But you know I know when it's a dream I think I know I mean a ""Yes"" but it's all wrong That is I think I disagree  Let me take you down, cause I'm going to Strawberry Fields Nothing is real and nothing to get hung about Strawberry Fields forever Strawberry Fields forever Strawberry Fields forever  Cranberry sauce","Magical Mystery Tour","1966","Lennon","Lennon",0,1,0,0,0,1,0,0,9,3,89,-6
"Sun King","Aaaaahhhhhhhhhh... Here comes the sun king Here comes the sun king Everybody's laughing Everybody's happy Here comes the sun king  Quando paramucho mi amore de felice carathon Mundo paparazzi mi amore cicce verdi parasol Questo abrigado tantamucho que canite carousel","Abbey Road","1969","Lennon","Lennon/McCartney/Harrison",0,1,0,0,1,1,1,0,0,1,30,1
"Taxman","One, two, three, four (for you, nineteen for me) One, two (one, two, three, four)  Let me tell you how it will be There's one for you, nineteen for me 'Cause I'm the taxman Yeah, I'm the taxman  Should five per cent appear too small Be thankful I don't take it all 'Cause I'm the taxman Yeah, I'm the taxman  (If you drive a car, car) I'll tax the street (If you try to sit, sit) I'll tax your seat (If you get too cold, cold) I'll tax the heat (If you take a walk, walk) I'll tax your feet Taxman  'Cause I'm the taxman Yeah, I'm the taxman  Don't ask me what I want it for (Ha, ha, Mr. Wilson) If you don't want to pay some more (Ha, ha, Mr. Heath) 'Cause I'm the taxman Yeah, I'm the taxman  Now my advice for those who die (Taxman) Declare the pennies on your eyes (Taxman) 'Cause I'm the taxman Yeah, I'm the taxman And you're working for no one but me (Taxman)","Revolver","1966","Harrison","Lennon/McCartney/Harrison",1,0,0,0,1,1,1,0,3,1,77,-2
"Tell Me What You See","If you let me take your heart I will prove to you We will never be apart if I'm part of you Open up your eyes now, tell me what you see It is no surprise now, what you see is me  Big and black the clouds may be, time will pass away If you put your trust in me I'll make bright your day Look into these eyes now, tell me what you see Don't you realise now, what you see is me Tell me what you see  Listen to me one more time, how can I get through? Can't you try to see that I'm trying to get to you? Open up your eyes now, tell me what you see It is no surprise now, what you see is me Tell me what you see  Listen to me one more time, how can I get through? Can't you try to see that I'm trying to get to you? Open up your eyes now, tell me what you see It is no surprise now, what you see is me","Help!","1965","Lennon/McCartney","Lennon/McCartney",0,1,1,0,0,1,1,0,0,2,74,2
"Tell Me Why","Tell me why you cried And why you lied to me Tell me why you cried And why you lied to me  Well, I gave you everything I had But you left me sitting on my own Did you have to treat me oh so bad? All I do is hang my head and moan  Tell me why you cried And why you lied to me Tell me why you cried And why you lied to me  If it's something that I've said or done Tell me what, and I'll apologize If you don't I really can't go on Holding back these tears in my eyes  Tell me why you cried And why you lied to me Tell me why you cried And why you lied to me  Well, I beg you on my bended knees If you'll only listen to my pleas Is there anything I can do 'Cause I really can't stand it, I'm so in love with you  Tell me why you cried And why you lied to me Tell me why you cried And why you lied to me","A Hard Day's Night","1964","Lennon","Lennon",0,1,0,0,0,1,0,0,13,3,40,-10
