"doc_id","text","album","year","songwriters","vocals","songwriter_Harrison","songwriter_Lennon","songwriter_McCartney","songwriter_Starr","vocals_Harrison","vocals_Lennon","vocals_McCartney","vocals_Starr","negative","positive","<NA>","sentiment"
"A Day in the Life","I read the news today oh, boy About a lucky man who made the grade And though the news was rather sad Well, I just had to laugh I saw the photograph He blew his mind out in a car He didn't notice that the lights had changed A crowd of people stood and stared They'd seen his face before Nobody was really sure if he was from the house of lords I saw a film today oh, boy The english army had just won the war A crowd of people turned away But I just had to look Having read the book I'd love to turn you on. Woke up, fell out of bed Dragged a comb across my head Found my way downstairs and drank a cup And looking up, I noticed I was late Found my coat and grabbed my hat Made the bus in seconds flat Found my way upstairs and had a smoke And somebody spoke and I went into a dream Ah I read the news today oh, boy Four thousand holes in blackburn, lancashire And though the holes were rather small They had to count them all Now they know how many holes it takes to fill the albert hall I'd love to turn you on","Sgt. Pepper's Lonely Hearts Club Band","1967","Lennon/McCartney","Lennon/McCartney",0,1,1,0,0,1,1,0,4,5,99,1
"A Hard Day's Night","It's been a hard day's night, and I've been working like a dog It's been a hard day's night, I should be sleeping like a log But when I get home to you I find the things that you do Will make me feel alright You know I work all day to get you money to buy you things And it's worth it just to hear you say you're going to give me everything So why on earth should I moan, 'cause when I get you alone You know I feel ok When I'm home everything seems to be right When I'm home feeling you holding me tight, tight, yeah It's been a hard day's night, and I've been working like a dog It's been a hard day's night, I should be sleeping like a log But when I get home to you I find the things that you do Will make me feel alright Owww! So why on earth should I moan, 'cause when I get you alone You know I feel lover well. When I'm home everything seems to be right When I'm home feeling you holding me tight, tight, yeah Oh, it's been a hard day's night, and I've been working like a dog It's been a hard day's night, I should be sleeping like a log But when I get home to you I find the things that you do Will make me feel alright You know I feel alright You know I feel alright","A Hard Day's Night","1964","Lennon/McCartney","Lennon/McCartney",0,1,1,0,0,1,1,0,8,12,97,4
"Across the Universe","Words are flowing out like endless rain into a paper cup, They slither while they pass, they slip away across the universe Pools of sorrow, waves of joy are drifting through my open mind, Possessing and caressing me. Jai guru deva om Nothing's gonna change my world, Nothing's gonna change my world, Nothing's gonna change my world, Nothing's gonna change my world. Images of broken light which dance before me like a million eyes, They call me on and on across the universe, Thoughts meander like a restless wind inside a letter box they Tumble blindly as they make their way Across the universe Jai guru deva om Nothing's gonna change my world, Nothing's gonna change my world, Nothing's gonna change my world, Nothing's gonna change my world. Sounds of laughter shades of light are ringing Through my open views inciting and inviting me Limitless undying love which shines around me like a Million suns, it calls me on and on Across the universe Jai guru deva om Nothing's gonna change my world, Nothing's gonna change my world, Nothing's gonna change my world, Nothing's gonna change my world. Jai guru deva Jai guru deva Jai guru deva","Let It Be","1968","Lennon","Lennon",0,1,0,0,0,1,0,0,4,6,122,2
"All I've Got to Do","Whenever I want you around, yeah. All I gotta do, Is call you on the phone, And you'll come running home, Yeah, that's all I gotta do. And when I, I want to kiss you, yeah. All I gotta do, Is whisper in your ear The words you long to hear, And I'll be kissin' you. Chorus: And the same goes for me, Whenever you want me at all. I'll be here, yes I will, whenever you call. You just gotta call on me, yeah, You just gotta call on me. And when I, I want to kiss you, yeah. All I gotta do, Is call you on the phone, And you'll come running home, Yeah, that's all I gotta do. [Chorus:]","With the Beatles","1963","Lennon","Lennon",0,1,0,0,0,1,0,0,0,0,49,0
"All My Loving","Close your eyes and I'll kiss you, Tomorrow I'll miss you; Remember I'll always be true. And then while I'm away, I'll write home ev'ry day, And I'll send all my loving to you. I'll pretend that I'm kissing The lips I am missing And hope that my dreams will come true. And then while I'm away, I'll write home ev'ry day, And I'll send all my loving to you. All my loving I will send to you. All my loving, darling I'll be true.","With the Beatles","1963","McCartney","McCartney",0,0,1,0,0,0,1,0,2,5,30,3
"All Together Now","One, two, three, four Can I have a little more? Five, six, seven eight nine ten I love you. A, B, C, D Can I bring my friend to tea? E, F, G H I J I love you. Sail the ship, Jump the tree Skip the rope, Look at me All together now... Black, white, green, red Can I take my friend to bed? Pink, brown, yellow orange blue I love you All together now... Sail the ship, Jump the tree Skip the rope, Look at me All together now...","Yellow Submarine","1967","Lennon/McCartney","Lennon/McCartney",0,1,1,0,0,1,1,0,0,3,49,3
"All You Need Is Love","Love, love, love. Love, love, love. Love, love, love. There's nothing you can do that can't be done. Nothing you can sing that can't be sung. Nothing you can say but you can learn how to play the game. It's easy. Nothing you can make that can't be made. No one you can save that can't be saved. Nothing you can do but you can learn how to be you in time. It's easy. All you need is love. All you need is love. All you need is love, love. Love is all you need. All you need is love. All you need is love. All you need is love, love. Love is all you need. Nothing you can know that isn't known. Nothing you can see that isn't shown. Nowhere you can be that isn't where you're meant to be. It's easy. All you need is love. All you need is love. All you need is love, love. Love is all you need. All you need is love (all together, now!) All you need is love. (everybody!) All you need is love, love. Love is all you need (love is all you need). Yee-hai! Oh yeah! She loves you, yeah yeah yeah. She loves you, yeah yeah yeah.","Magical Mystery Tour","1967","Lennon","Lennon",0,1,0,0,0,1,0,0,0,35,66,35
"And I Love Her","I give her all my love That's all I do And if you saw my love You'd love her too I love her She gives me ev'rything And tenderly The kiss my lover brings She brings to me And I love her A love like ours Could never die As long as I Have you near me Bright are the stars that shine Dark is the sky I know this love of mine Will never die And I love her Bright are the stars that shine Dark is the sky I know this love of mine Will never die And I love her","A Hard Day's Night","1964","Lennon/McCartney","McCartney",0,1,1,0,0,0,1,0,5,17,22,12
"And Your Bird Can Sing","You tell me that you've got everything you want And your bird can sing But you don't get me, you don't get me You say you've seen seven wonders and your bird is green But you can't see me, you can't see me When your prized possessions start to wear you down Look in my direction, I'll be round, I'll be round When your bird is broken will it bring you down You may be awoken, I'll be round, I'll be round You tell me that you've heard every sound there is And your bird can swing But you can't hear me, you can't hear me","Revolver","1966","Lennon/McCartney","Lennon",0,1,1,0,0,1,0,0,1,1,40,0
"Another Girl","For I have got another girl, Another girl. You're making me say that I've got Nobody but you. But as from today, well I've seen Somebody that's new. I ain't no fool an I don't take what I don't want For I have got another girl, Another girl. She's sweeter than all the girls and I've met quite a few. Nobody in all the world can Do what she can do. And so I'm telling you this time you better stop For I have got another girl, Another girl Who will love me to the end, Through thick and thin She will always be my friend. I don't wanna say that I've been Unhappy with you. But as from today well I've seen Somebody that's new. I ain't no fool an I don't take what I don't want For I have got another girl, Another girl, another girl","Help!","1965","McCartney","McCartney",0,0,1,0,0,0,1,0,3,4,60,1
"Any Time at All","Any time at all, Any time at all, Any time at all, All you've gotta do is call and I'll be there. If you need somebody to love, Just look into my eyes, I'll be there to make you feel right. If you're feeling sorry and sad, I'd really sympathize. Don't you be sad, just call me tonight. Any time at all, Any time at all, Any time at all, All you've gotta do is call and I'll be there. If the sun has faded away, I'll try to make it shine, There's nothing I won't do If you need a shoulder to cry on, I hope it will be mine. Call me tonight, and I'll come to you. Any time at all, Any time at all, Any time at all, All you've gotta do is call and I'll be there. Any time at all, All you've gotta do is call and I'll be there.","A Hard Day's Night","1964","Lennon/McCartney","Lennon",0,1,1,0,0,1,0,0,4,3,45,-1
"Ask Me Why","I love you, 'cause you tell me things I want to know. And it's true that it really only goes to show, That I know, That I, should never ever ever be blue. Now you're mine, my happiness still makes me cry. And in time, you'll understand the reason why, If I cry, It's not because I'm sad, But you're the only love that I've ever had. I can't believe it's happened to me. I can't conceive of any more misery. Ask me why, I'll say I love you, And I'm always thinking of you. I love you, 'cause you tell me things I want to know. And it's true that it really only goes to show, That I know, That I, should never ever ever be blue. Ask me why, I'll say I love you, And I'm always thinking of you. I can't believe it's happened to me. I can't conceive of any more misery. Ask me why, I'll say I love you, And I'm always thinking of you.","Please Please Me","1963","Lennon/McCartney","Lennon",0,1,1,0,0,1,0,0,5,7,54,2
"Baby's in Black","Oh dear, what can I do? Baby's in black and I'm feeling blue, Tell me, oh what can I do? She thinks of him, And so she dresses in black, And though he'll never come back, She's dressed in black. Oh dear, what can I do? Baby's in black and I'm feeling blue, Tell me, oh what can I do? I think of her, but she only thinks of him, And though it's only a whim, she thinks of him. Oh how long will it take, Till she sees the mistake she has made? Dear what can I do? Baby's in black and I'm feeling blue, Tell me, oh what can I do? Oh how long it will take, Till she sees the mistake she has made? Dear what can I do? Baby's in black and I'm feeling blue, Tell me, oh what can I do? She thinks of him, And so she dresses in black, And though he'll never come back, She's dressed in black. Oh dear, what can I do? Baby's in black and I'm feeling blue, Tell me, oh what can I do?","Beatles for Sale","1964","Lennon/McCartney","Lennon/McCartney",0,1,1,0,0,1,1,0,2,0,75,-2
"Baby, You're a Rich Man","How does it feel to be One of the beautiful people? Now that you know who you are What do you want to be? And have you travelled very far? Far as the eye can see. How does it feel to be One of the beautiful people? How often have you been there? Often enough to know. What did you see, when you were there? Nothing that doesn't show. Baby you're a rich man, Baby you're a rich man, Baby you're a rich man too. You keep all your money in a big brown bag inside a zoo. What a thing to do. Baby you're a rich man, Baby you're a rich man, Baby you're a rich man too. How does it feel to be One of the beautiful people? Tuned to A natural E Happy to be that way. Now that you've found another key What are you going to play? Baby you're a rich man, Baby you're a rich man, Baby you're a rich man too. You keep all your money in a big brown bag inside a zoo. What a thing to do. Baby you're a rich man...","Magical Mystery Tour","1967","Lennon/McCartney","Lennon",0,1,1,0,0,1,0,0,0,15,69,15
"Back in the U.S.S.R.","Oh, flew in from Miami Beach B. O. A. C. Didn't get to bed last night On the way the paper bag was on my knee Man I had a dreadful flight I'm back in the you. S. S. Are. You don't know how lucky you are boy Back in the you. S. S. Are. (Yeah)  Been away so long I hardly knew the place Gee it's good to be back home Leave it till tomorrow to unpack my case Honey disconnect the phone I'm back in the you. S. S. Are. You don't know how lucky you are boy Back in the you. S. Back in the you. S. Back in the you. S. S. Are.  Well the Ukraine girls really knock me out They leave the West behind And Moscow girls make me sing and shout That Georgia's always on my mind  Aw come on! Ho yeah! Ho yeah! Ho ho yeah! Yeah yeah!  Yeah I'm back in the you. S. S. Are. You don't know how lucky you are boys Back in the you. S. S. Are.  Well the Ukraine girls really knock me out They leave the West behind And Moscow girls make me sing and shout That Georgia's always on my mind  Oh, show me around your snow-peaked mountains way down south Take me to your daddy's farm Let me hear your balalaika's ringing out Come and keep your comrade warm I'm back in the you. S. S. Are. Hey you don't know how lucky you are boys Back in the you. S. S. Are.  Oh let me tell you, honey Hey, I'm back! I'm back in the you. S. S. Are. Yes, I'm free! Yeah, back in the you. S. S. Are.  Ha ha","The Beatles","1968","McCartney","McCartney",0,0,1,0,0,0,1,0,3,9,109,6
"Because","(Lennon/Mccartney) Aaaaaahhhhhh... Because the world is round it turns me on Because the world is round... Aaaaaahhhhhh Because the wind is high it blows my mind Because the wind is high... Aaaaaaaahhhh Love is all, love is new Love is all, love is you Because the sky is blue, it makes me cry Because the sky is blue... Aaaaaaaahhhh Aaaaahhhhhhhhhh... Aaaaahhhhhhhhhh... Aaaaahhhhhhhhhh...","Abbey Road","1969","Lennon","Harrison",0,1,0,0,1,0,0,0,1,4,25,3
"Being for the Benefit of Mr. Kite!","For the benefit of Mr. Kite There will be a show tonight on trampoline  The Hendersons will all be there Late of Pablo Fanques Fair, what a scene!  Over men and horses hoops and garters Lastly through a hogshead of real fire! In this way Mr. Kite will challenge the world!  The celebrated Mr. Kite Performs his feat on Saturday at Bishopsgate  The Hendersons will dance and sing As Mr. Kite flys through the ring, don't be late!  Messrs. K and H assure the public Their production will be second to none And of course Henry The Horse dances the waltz!  The band begins at ten to six When Mr. Kite performs his tricks without a sound  And Mr. H will demonstrate Ten summersets he'll undertake on solid ground  Having been some days in preparation A splendid time is guaranteed for all And tonight Mr. Kite is topping the bill!","Sgt. Pepper's Lonely Hearts Club Band","1967","Lennon/McCartney","Lennon",0,1,1,0,0,1,0,0,0,7,70,7
"Birthday","(Lennon/Mccartney) They say it's your birthday It's my birthday too, yeah They say it's your birthday We're gonna have a good time I'm glad it's your birthday Happy birthday to you Ah Ah Ah Come on Come on Yes we're going to a party party Yes we're going to a party party Yes we're going to a party party I would like you to dance (Birthday) Take a cha-cha-cha-chance (Birthday) I would like you to dance (Birthday) Dance yeah Oh Come on I would like you to dance (Birthday) Take a cha-cha-cha-chance (Birthday) I would like you to dance (Birthday) Oh dance! Dance They say it's your birthday Well it's my birthday too, yeah They say it's your birthday We're gonna have a good time I'm glad it's your birthday Happy birthday to you","The Beatles","1968","Lennon/McCartney","Lennon/McCartney",0,1,1,0,0,1,1,0,0,11,54,11
"Blackbird","Blackbird singing in the dead of night Take these broken wings and learn to fly All your life You were only waiting for this moment to arise. Blackbird singing in the dead of night Take these sunken eyes and learn to see All your life You were only waiting for this moment to be free. Blackbird fly blackbird fly Into the light of the dark black night. Blackbird fly blackbird fly Into the light of the dark black night. Blackbird singing in the dead of night Take these broken wings and learn to fly All your life You were only waiting for this moment to arise You were only waiting for this moment to arise You were only waiting for this moment to arise.","The Beatles","1968","McCartney","McCartney",0,0,1,0,0,0,1,0,8,1,52,-7
"Blue Jay Way","There's a fog upon L. A. And my friends have lost their way We'll be over soon they said Now they've lost themselves instead. Please don't be long please don't you be very long Please don't be long or I may be asleep Well it only goes to show And I told them where to go Ask a policeman on the street There's so many there to meet Please don't be long please don't you be very long Please don't be long or I may be asleep Now it's past my bed I know And I'd really like to go Soon will be the break of day Sitting here in Blue Jay Way Please don't be long please don't you be very long Please don't be long or I may be asleep. Please don't be long please don't you be very long Please don't be long (2 times more) Don't be long Don't be long","Magical Mystery Tour","1967","Harrison","Harrison",1,0,0,0,1,0,0,0,3,2,61,-1
"Can't Buy Me Love","Can't buy me love, love Can't buy me love I'll buy you a diamond ring my friend if it makes you feel alright I'll get you anything my friend if it makes you feel alright 'Cause I don't care too much for money, money can't buy me love I'll give you all I got to give if you say you love me too I may not have a lot to give but what I got I'll give to you I don't care too much for money, money can't buy me love Can't buy me love, everybody tells me so Can't buy me love, no no no, no Say you don't need no diamond ring and I'll be satisfied Tell me that you want the kind of thing that money just can't buy I don't care too much for money, money can't buy me love","A Hard Day's Night","1964","McCartney","Lennon/McCartney",0,0,1,0,0,1,1,0,0,10,55,10
"Carry That Weight","Boy, you gotta carry that weight Carry that weight a long time Boy, you gotta carry that weight Carry that weight a long time I never give you my pillow I only send you my invitation And in the middle of the celebrations I break down Boy, you gotta carry that weight Carry that weight a long time Boy, you gotta carry that weight Carry that weight a long time","Abbey Road","1969","McCartney","Lennon/Harrison/Starr",0,0,1,0,0,1,0,0,1,0,39,-1
"Come Together","Here come old flattop he come grooving up slowly He got juju eyeball he one holy roller He got hair down to his knee Got to be a joker he just do what he please He wear no shoeshine he got toe-jam football He got monkey finger he shoot coca-cola He say ""I know you, you know me"" One thing I can tell you is you got to be free Come together right now over me He bag production he got walrus gumboot He got ono sideboard he one spinal cracker He got feet down below his knee Hold you in his armchair you can feel his disease Come together right now over me He roller-coaster he got early warning He got muddy water he one mojo filter He say ""one and one and one is three"" Got to be good-looking 'cause he's so hard to see Come together right now over me","Abbey Road","1969","Lennon","Lennon",0,1,0,0,0,1,0,0,6,5,78,-1
"Cry Baby Cry","Cry baby cry Make your mother sigh She's old enough to know better The king of Marigold was in the kitchen Cooking breakfast for the queen The queen was in the parlour Playing piano for the children of the king Cry baby cry Make your mother sigh She's old enough to know better So cry baby cry The king was in the garden Picking flowers for a friend who came to play The queen was in the playroom Painting pictures for the childrens holiday Cry baby cry Make your mother sigh She's old enough to know better So cry baby cry The duchess of Kircaldy always smiling And arriving late for tea The duke was having problems With a message at the local bird and bee Cry baby cry Make your mother sigh She's old enough to know better So cry baby cry At twelve o'clock a meeting round the table For a seance in the dark With voices out of nowhere Put on specially by the children for a lark Cry baby cry Make your mother sigh She's old enough to know better So cry baby cry cry cry cry baby Make your mother sigh She's old enough to know better Cry baby cry Cry cry cry Make your mother sigh She's old enough to know better So cry baby cry","The Beatles","1968","Lennon","Lennon/McCartney",0,1,0,0,0,1,1,0,30,15,95,-15
"Day Tripper","Got a good reason for taking the easy way out Got a good reason for taking the easy way out now She was a day tripper, a one way ticket yeah It took me so long to find out, and I found out She's a big teaser, she took me half the way there She's a big teaser, she took me half the way there now She was a day tripper, a one way ticket yeah It took me so long to find out, and I found out Tried to please her, she only played one night stands Tried to please her, she only played one night stands now She was a day tripper, a Sunday driver yeah It took me so long to find out, and I found out Day tripper Day tripper yeah Day tripper Day tripper yeah Day tripper",NA,"1965","Lennon/McCartney","Lennon/McCartney",0,1,1,0,0,1,1,0,0,4,74,4
"Dear Prudence","Dear Prudence, won't you come out to play Dear Prudence, greet the brand new day The sun is up, the sky is blue It's beautiful and so are you Dear Prudence won't you come out and play? Dear Prudence, open up your eyes Dear Prudence, see the sunny skies The wind is low, the birds will sing That you are part of everything Dear Prudence won't you open up your eyes? Look around round (Round, round, round...) Look around round (Round, round, round...) Look around Dear Prudence, let me see you smile Dear Prudence, like a little child The clouds will be a daisy chain So let me see you smile again Dear Prudence won't you let me see you smile?","The Beatles","1968","Lennon","Lennon",0,1,0,0,0,1,0,0,0,14,60,14
"Dig It","Like a rolling stone A like a rolling stone Like the fbi and the cia And the bbc Bb King And Doris Day Matt Busby Dig it, dig it, dig it Dig it, dig it, dig it, dig it, dig it, dig it, dig it, dig it","Let It Be","1969","Lennon/McCartney/Harrison/Starr","Lennon",1,1,1,1,0,1,0,0,0,3,23,3
"Dig a Pony","I dig a pony Well you can celebrate anything you want Well you can celebrate anything you want Ooh. I do a road hog Well you can penetrate any place you go Yes you can penetrate any place you go I told you, all I want is you. Everything has got to be just like you want it to Because I pick a moon dog Well you can radiate everything you are Yes you can radiate everything you are Ooh I roll a stoney Well you can imitate everyone you know Yes you can imitate everyone you know I told you, all I want is you. Everything has got to be just like you want it to Because I feel the wind blow Well you can indicate everything you see Yes you can indicate everything you see Ooh I dug a pony Well you can syndicate any boat you row Yes you can syndicate any boat you row I told you, all I want is you Everything has got to bejust like you want it to Because","Let It Be","1969","Lennon","Lennon",0,1,0,0,0,1,0,0,1,12,81,11
"Do You Want to Know a Secret?","You'll never know how much I really love you You'll never know how much I really care  Listen Do you want to know a secret Do you promise not to tell, whoa oh, oh  Closer Let me whisper in your ear Say the words you long to hear I'm in love with you  Listen Do you want to know a secret Do you promise not to tell, whoa oh, oh  Closer Let me whisper in your ear Say the words you long to hear I'm in love with you  I've known the secret for a week or two Nobody knows, just we two  Listen Do you want to know a secret Do you promise not to tell, whoa oh, oh  Closer Let me whisper in your ear Say the words you long to hear I'm in love with you","Please Please Me","1963","Lennon","Harrison",0,1,0,0,1,0,0,0,0,10,56,10
"Doctor Robert","Ring my friend, I said you call Doctor Robert Day or night he'll be there any time at all, Doctor Robert Doctor Robert, you're a new and better man He helps you to understand He does everything he can, Doctor Robert  If you're down he'll pick you up, Doctor Robert Take a drink from his special cup, Doctor Robert Doctor Robert, he's a man you must believe Helping everyone in need No one can succeed like Doctor Robert  Well, well, well, you're feeling fine Well, well, well, he'll make you... Doctor Robert  My friend works for the national health, Doctor Robert Don't pay money just to see yourself with Doctor Robert Doctor Robert, you're a new and better man He helps you to understand He does everything he can, Doctor Robert  Well, well, well, you're feeling fine Well, well, well, he'll make you... Doctor Robert  Ring my friend, I said you'd call Doctor Robert Ring my friend, I said you'd call Doctor Robert Doctor Robert","Revolver","1966","Lennon/McCartney","Lennon",0,1,1,0,0,1,0,0,0,20,84,20
